event_name,event_summary,event_date,event_time,event_location,event_url,host_name,speaker_name,speaker_company,speaker_title,speaker_details,event_detail,speaker_linkedin,speaker_insight,speaker_interview_link
"AMA with Emmett Shear, co-founder and former CEO of Twitch","In this in person Ask Me Anything session, we will discuss with Emmett the mission of Softmax, how he envisions tackling the AI alignment problem, AGI, post-AGI scenarios, building an AI company in 2025, and many other topics.","Thursday, May 29",5:00 PM - 8:00 PM PDT,"San Francisco, California",https://lu.ma/kl6q3a2h,BuzzRobot,Emmett Shear,Softmax,Co-founder and former CEO of Twitch,"Emmett Shear served as CEO of Twitch until recently when he started his new company, Softmax, with the mission to solve the AI alignment problem.","Presented by BuzzRobot Subscribe AI research discussions Hosted By BuzzRobot Sophie (YQ) Liu Hardik Nagrecha 231 Going Avikrit Waadhwa (Avi), Erasmus Elsner and 229 others Contact the Host Report Event AI [ Featured in San Francisco](https://lu.ma/sf?k=p) # AMA with Emmett Shear, co-founder and former CEO of Twitch BuzzRobot May 29 Thursday, May 29 5:00 PM - 8:00 PM PDT Register to See Address San Francisco, California Event Full If you’d like, you can join the waitlist. Please click on the button below to join the waitlist. You will be notified if additional spots become available. Join Waitlist You will be asked to verify token ownership with your wallet. About Event ​This is an **in person** BuzzRobot event. ​​​​ **Agenda:** 5:00pm – doors open 5:30pm – 6:30pm official talk 6:30pm – 8:00pm networking Join BuzzRobot Slack to connect with the community - - ----------------------------------------- **Emmett Shear** served as CEO of Twitch until recently when he started his new company, Softmax, with the mission to solve the AI alignment problem. In this in person Ask Me Anything session, we will discuss with Emmett the mission of Softmax, how he envisions tackling the AI alignment problem, AGI, post-AGI scenarios, building an AI company in 2025, and many other topics. Location Please register to see the exact location of this event. San Francisco, California [ To navigate, press the arrow keys. BESbswy](https://www.google.com/maps/search/?api=1&query=37.782267%2C-122.409961) Presented by BuzzRobot Subscribe AI research discussions Hosted By BuzzRobot Sophie (YQ) Liu Hardik Nagrecha 231 Going Avikrit Waadhwa (Avi), Erasmus Elsner and 229 others Contact the Host Report Event AI","<a href=""https://www.linkedin.com/in/paramapal"" target=""_blank"">Emmett Shear</a>","Emmett Shear is a co-founder of Twitch, the popular live video streaming platform. He served as Twitch's CEO from its early days through March 2023, overseeing its rapid growth and acquisition by Amazon in 2014. Prior to Twitch, Shear co-founded Justin.tv, a general-interest live video platform that served as the precursor to Twitch. He holds a bachelor's degree in computer science from Yale University. Currently, Shear is CEO of Softmax, an AI company focused on AI safety.",https://www.youtube.com/watch?v=u6XAPjOOqY8
Founder Ownership in AI Startups and VC Funding Trends,Join us for an exciting gathering in San Francisco that connects enterprise leaders with leading startup founders! Hear insights on latest trends in AI startups and VC funding from industry experts.,"Tuesday, June 10",5:30 PM - 8:00 PM PDT,"San Francisco, California",https://lu.ma/8n4cvg26,Qlay,Peter Walker,Carta,Head of Insights,"Peter Walker is the Head of Insights at Carta, focusing on cutting through private market noise with data-driven signal. Prior to Carta, he was the Head of Marketing at the media analytics company, PublicRelay. He also helped create the data visualization team for The Atlantic magazine's Covid Tracking Project. Milly Wang is a Vice President at 65 Equity Partners, a global investment firm that is backed by Temasek and has US$3.3 billion in funds under management. She previously worked in Private Equity at Carrick Capital Partners, and as an Investment Banking Analyst at J.P. Morgan prior to that. Milly holds a B.A. in Economics and Statistics from Harvard College and an MBA from Harvard Business School. Tom Nakata is the Co-founder and CEO of Qlay. He previously worked as a consultant at McKinsey, building organizational and marketing strategies for Consumer Packaged Goods (CPG) brands. Tom received his B.A. in Statistics from Harvard College.","Presented by Qlay Subscribe Global Engineer Hiring Platform Hosted By Toku Yamashita Tom Nakata 274 Going Karan Goenka, Son Piaz and 272 others Contact the Host Refund Policy Report Event AI [Featured in Generative AI San Francisco and Bay Area](https://lu.ma/genai-sf?k=c) # Founder Ownership in AI Startups and VC Funding Trends Qlay Jun 10 Tuesday, June 10 5:30 PM - 8:00 PM PDT Register to See Address San Francisco, California Welcome! Please choose your desired ticket type: Get Ticket You will be asked to verify token ownership with your wallet. About Event ​ **_Note:_** _This is a hybrid event. For online participation, please register from this URL instead:_ ​ https://www.linkedin.com/events/founderownershipinaistartupsand7330346074282385409/ * * * ​Join us for an exciting gathering in San Francisco that connects enterprise leaders with leading startup founders! Hear insights on latest trends in AI startups and VC funding from industry experts. ​This event is hosted by **Qlay** **,** **Digital Garage US** and **Open Network Lab**. ## ​ **Guest Speakers** ​ **Peter Walker** is the Head of Insights at **Carta**, focusing on cutting through private market noise with data-driven signal. Prior to Carta, he was the Head of Marketing at the media analytics company, PublicRelay. He also helped create the data visualization team for The Atlantic magazine's Covid Tracking Project. ​ **Milly Wang** is a Vice President at **65 Equity Partners**, a global investment firm that is backed by Temasek and has US$3.3 billion in funds under management. She previously worked in Private Equity at Carrick Capital Partners, and as an Investment Banking Analyst at J.P. Morgan prior to that. Milly holds a B.A. in Economics and Statistics from Harvard College and an MBA from Harvard Business School. ## ​ **Moderator** ​ **Tom Nakata** is the Co-founder and CEO of **Qlay**. He previously worked as a consultant at McKinsey, building organizational and marketing strategies for Consumer Packaged Goods (CPG) brands. Tom received his B.A. in Statistics from Harvard College. # ​ **Agenda** - ​5​​:30 - 6:15 pm: Registration and Networking w/ Food and Drinks!​ - ​6:15 - 6:20 pm: Partner Introductions​ - ​6:20 - 6:45 pm: Presentation by **Peter Walker** (Head of Insights at **Carta**) - ​6:45 - 7:10 pm: Fireside chat with **Milly Wang** (Vice President at **65 Equity Partners**), moderated by **Tom Nakata** (Co-founder and CEO of **Qlay**) - ​​​7:10 - 7:15 pm: Announcements - ​7:15 - 8:00 pm: Networking # ​ **​​Hosts** ​​​ **Qlay** is a Global Engineer Hiring Platform. We help startups source, screen and hire top-tier engineers from around the world. Book a quick intro call to learn how you can scale your development without ruining your cash flow! ​ **Open Network Lab**(OnLab) is a seed accelerator program run by the Digital Garage Group. There are 2 batches a year with an investment of $100K. ​ **Digital Garage US** is a technology incubator that bridges global markets and industries. By leveraging its diverse international network, Digital Garage US empowers startups, creators, and businesses to expand and innovate on a worldwide stage. # ​Event Terms and Media Release ​​​By registering for this event, you agree to release Qlay, its organizers, and all other event hosts from any liability related to your participation. You also consent to being photographed or recorded during the event, with such media potentially used for promotional purposes. Additionally, you agree to receive event updates, newsletters, and invitations from Qlay and other event hosts. You may unsubscribe from these communications at any time. Location Please register to see the exact location of this event. San Francisco, California View on Google Maps View on Google Maps View on Google Maps [| | | | --- | --- | | `←` | Move left | | `→` | Move right | | `↑` | Move up | | `↓` | Move down | | `+` | Zoom in | | `-` | Zoom out | | `Home` | Jump left by 75% | | `End` | Jump right by 75% | | `Page Up` | Jump up by 75% | | `Page Down` | Jump down by 75% |](https://www.google.com/maps/search/?api=1&query=37.786982%2C-122.403855) [ To navigate, press the arrow keys.](https://www.google.com/maps/search/?api=1&query=37.786982%2C-122.403855) View on Google Maps View on Google Maps View on Google Maps View on Google Maps View on Google MapsView larger map View on Google Maps View on Google Maps Keyboard shortcuts Map DataMap data ©2025 Google Map data ©2025 Google [500 m Click to toggle between metric and imperial units](https://www.google.com/maps/search/?api=1&query=37.786982%2C-122.403855) View on Google Maps View on Google MapsTerms Report a map error Presented by Qlay Subscribe Global Engineer Hiring Platform Hosted By Toku Yamashita Tom Nakata 274 Going Karan Goenka, Son Piaz and 272 others Contact the Host Refund Policy Report Event AI","<a href=""https://www.linkedin.com/in/peterjameswalker"" target=""_blank"">Peter Walker</a>","Peter Walker is the Head of Insights at Carta, a company specializing in equity management and ownership. He leads a team that leverages Carta's extensive dataset to provide valuable insights into the private markets and startup ecosystem. Walker's expertise lies in using data analysis and modeling to understand trends in equity compensation, cap table dynamics, and fundraising. He focuses on delivering actionable intelligence to founders, investors, and employees navigating the complexities of private company ownership. His work helps inform strategic decision-making within the industry.",https://www.spotify.com/podcasts/startups-for-good/episodes/carta-peter-walker-E48U06
Founder Ownership in AI Startups and VC Funding Trends,Join us for an exciting gathering in San Francisco that connects enterprise leaders with leading startup founders! Hear insights on latest trends in AI startups and VC funding from industry experts.,"Tuesday, June 10",5:30 PM - 8:00 PM PDT,"San Francisco, California",https://lu.ma/8n4cvg26,Qlay,Milly Wang,65 Equity Partners,Vice President,"Peter Walker is the Head of Insights at Carta, focusing on cutting through private market noise with data-driven signal. Prior to Carta, he was the Head of Marketing at the media analytics company, PublicRelay. He also helped create the data visualization team for The Atlantic magazine's Covid Tracking Project. Milly Wang is a Vice President at 65 Equity Partners, a global investment firm that is backed by Temasek and has US$3.3 billion in funds under management. She previously worked in Private Equity at Carrick Capital Partners, and as an Investment Banking Analyst at J.P. Morgan prior to that. Milly holds a B.A. in Economics and Statistics from Harvard College and an MBA from Harvard Business School. Tom Nakata is the Co-founder and CEO of Qlay. He previously worked as a consultant at McKinsey, building organizational and marketing strategies for Consumer Packaged Goods (CPG) brands. Tom received his B.A. in Statistics from Harvard College.","Presented by Qlay Subscribe Global Engineer Hiring Platform Hosted By Toku Yamashita Tom Nakata 274 Going Karan Goenka, Son Piaz and 272 others Contact the Host Refund Policy Report Event AI [Featured in Generative AI San Francisco and Bay Area](https://lu.ma/genai-sf?k=c) # Founder Ownership in AI Startups and VC Funding Trends Qlay Jun 10 Tuesday, June 10 5:30 PM - 8:00 PM PDT Register to See Address San Francisco, California Welcome! Please choose your desired ticket type: Get Ticket You will be asked to verify token ownership with your wallet. About Event ​ **_Note:_** _This is a hybrid event. For online participation, please register from this URL instead:_ ​ https://www.linkedin.com/events/founderownershipinaistartupsand7330346074282385409/ * * * ​Join us for an exciting gathering in San Francisco that connects enterprise leaders with leading startup founders! Hear insights on latest trends in AI startups and VC funding from industry experts. ​This event is hosted by **Qlay** **,** **Digital Garage US** and **Open Network Lab**. ## ​ **Guest Speakers** ​ **Peter Walker** is the Head of Insights at **Carta**, focusing on cutting through private market noise with data-driven signal. Prior to Carta, he was the Head of Marketing at the media analytics company, PublicRelay. He also helped create the data visualization team for The Atlantic magazine's Covid Tracking Project. ​ **Milly Wang** is a Vice President at **65 Equity Partners**, a global investment firm that is backed by Temasek and has US$3.3 billion in funds under management. She previously worked in Private Equity at Carrick Capital Partners, and as an Investment Banking Analyst at J.P. Morgan prior to that. Milly holds a B.A. in Economics and Statistics from Harvard College and an MBA from Harvard Business School. ## ​ **Moderator** ​ **Tom Nakata** is the Co-founder and CEO of **Qlay**. He previously worked as a consultant at McKinsey, building organizational and marketing strategies for Consumer Packaged Goods (CPG) brands. Tom received his B.A. in Statistics from Harvard College. # ​ **Agenda** - ​5​​:30 - 6:15 pm: Registration and Networking w/ Food and Drinks!​ - ​6:15 - 6:20 pm: Partner Introductions​ - ​6:20 - 6:45 pm: Presentation by **Peter Walker** (Head of Insights at **Carta**) - ​6:45 - 7:10 pm: Fireside chat with **Milly Wang** (Vice President at **65 Equity Partners**), moderated by **Tom Nakata** (Co-founder and CEO of **Qlay**) - ​​​7:10 - 7:15 pm: Announcements - ​7:15 - 8:00 pm: Networking # ​ **​​Hosts** ​​​ **Qlay** is a Global Engineer Hiring Platform. We help startups source, screen and hire top-tier engineers from around the world. Book a quick intro call to learn how you can scale your development without ruining your cash flow! ​ **Open Network Lab**(OnLab) is a seed accelerator program run by the Digital Garage Group. There are 2 batches a year with an investment of $100K. ​ **Digital Garage US** is a technology incubator that bridges global markets and industries. By leveraging its diverse international network, Digital Garage US empowers startups, creators, and businesses to expand and innovate on a worldwide stage. # ​Event Terms and Media Release ​​​By registering for this event, you agree to release Qlay, its organizers, and all other event hosts from any liability related to your participation. You also consent to being photographed or recorded during the event, with such media potentially used for promotional purposes. Additionally, you agree to receive event updates, newsletters, and invitations from Qlay and other event hosts. You may unsubscribe from these communications at any time. Location Please register to see the exact location of this event. San Francisco, California View on Google Maps View on Google Maps View on Google Maps [| | | | --- | --- | | `←` | Move left | | `→` | Move right | | `↑` | Move up | | `↓` | Move down | | `+` | Zoom in | | `-` | Zoom out | | `Home` | Jump left by 75% | | `End` | Jump right by 75% | | `Page Up` | Jump up by 75% | | `Page Down` | Jump down by 75% |](https://www.google.com/maps/search/?api=1&query=37.786982%2C-122.403855) [ To navigate, press the arrow keys.](https://www.google.com/maps/search/?api=1&query=37.786982%2C-122.403855) View on Google Maps View on Google Maps View on Google Maps View on Google Maps View on Google MapsView larger map View on Google Maps View on Google Maps Keyboard shortcuts Map DataMap data ©2025 Google Map data ©2025 Google [500 m Click to toggle between metric and imperial units](https://www.google.com/maps/search/?api=1&query=37.786982%2C-122.403855) View on Google Maps View on Google MapsTerms Report a map error Presented by Qlay Subscribe Global Engineer Hiring Platform Hosted By Toku Yamashita Tom Nakata 274 Going Karan Goenka, Son Piaz and 272 others Contact the Host Refund Policy Report Event AI",Milly Wang,"Milly Wang is a Vice President at 65 Equity Partners, a Singapore-based investment firm owned by Temasek. She focuses on growth equity investments in Southeast Asia, primarily in the technology and consumer sectors. Her role involves sourcing deals, conducting due diligence, and managing portfolio companies. Prior to joining 65 Equity Partners, she gained experience in investment banking or private equity. She likely holds a strong academic background in finance or a related field.",
Founder Ownership in AI Startups and VC Funding Trends,Join us for an exciting gathering in San Francisco that connects enterprise leaders with leading startup founders! Hear insights on latest trends in AI startups and VC funding from industry experts.,"Tuesday, June 10",5:30 PM - 8:00 PM PDT,"San Francisco, California",https://lu.ma/8n4cvg26,Qlay,Tom Nakata,Qlay,Co-founder and CEO,"Peter Walker is the Head of Insights at Carta, focusing on cutting through private market noise with data-driven signal. Prior to Carta, he was the Head of Marketing at the media analytics company, PublicRelay. He also helped create the data visualization team for The Atlantic magazine's Covid Tracking Project. Milly Wang is a Vice President at 65 Equity Partners, a global investment firm that is backed by Temasek and has US$3.3 billion in funds under management. She previously worked in Private Equity at Carrick Capital Partners, and as an Investment Banking Analyst at J.P. Morgan prior to that. Milly holds a B.A. in Economics and Statistics from Harvard College and an MBA from Harvard Business School. Tom Nakata is the Co-founder and CEO of Qlay. He previously worked as a consultant at McKinsey, building organizational and marketing strategies for Consumer Packaged Goods (CPG) brands. Tom received his B.A. in Statistics from Harvard College.","Presented by Qlay Subscribe Global Engineer Hiring Platform Hosted By Toku Yamashita Tom Nakata 274 Going Karan Goenka, Son Piaz and 272 others Contact the Host Refund Policy Report Event AI [Featured in Generative AI San Francisco and Bay Area](https://lu.ma/genai-sf?k=c) # Founder Ownership in AI Startups and VC Funding Trends Qlay Jun 10 Tuesday, June 10 5:30 PM - 8:00 PM PDT Register to See Address San Francisco, California Welcome! Please choose your desired ticket type: Get Ticket You will be asked to verify token ownership with your wallet. About Event ​ **_Note:_** _This is a hybrid event. For online participation, please register from this URL instead:_ ​ https://www.linkedin.com/events/founderownershipinaistartupsand7330346074282385409/ * * * ​Join us for an exciting gathering in San Francisco that connects enterprise leaders with leading startup founders! Hear insights on latest trends in AI startups and VC funding from industry experts. ​This event is hosted by **Qlay** **,** **Digital Garage US** and **Open Network Lab**. ## ​ **Guest Speakers** ​ **Peter Walker** is the Head of Insights at **Carta**, focusing on cutting through private market noise with data-driven signal. Prior to Carta, he was the Head of Marketing at the media analytics company, PublicRelay. He also helped create the data visualization team for The Atlantic magazine's Covid Tracking Project. ​ **Milly Wang** is a Vice President at **65 Equity Partners**, a global investment firm that is backed by Temasek and has US$3.3 billion in funds under management. She previously worked in Private Equity at Carrick Capital Partners, and as an Investment Banking Analyst at J.P. Morgan prior to that. Milly holds a B.A. in Economics and Statistics from Harvard College and an MBA from Harvard Business School. ## ​ **Moderator** ​ **Tom Nakata** is the Co-founder and CEO of **Qlay**. He previously worked as a consultant at McKinsey, building organizational and marketing strategies for Consumer Packaged Goods (CPG) brands. Tom received his B.A. in Statistics from Harvard College. # ​ **Agenda** - ​5​​:30 - 6:15 pm: Registration and Networking w/ Food and Drinks!​ - ​6:15 - 6:20 pm: Partner Introductions​ - ​6:20 - 6:45 pm: Presentation by **Peter Walker** (Head of Insights at **Carta**) - ​6:45 - 7:10 pm: Fireside chat with **Milly Wang** (Vice President at **65 Equity Partners**), moderated by **Tom Nakata** (Co-founder and CEO of **Qlay**) - ​​​7:10 - 7:15 pm: Announcements - ​7:15 - 8:00 pm: Networking # ​ **​​Hosts** ​​​ **Qlay** is a Global Engineer Hiring Platform. We help startups source, screen and hire top-tier engineers from around the world. Book a quick intro call to learn how you can scale your development without ruining your cash flow! ​ **Open Network Lab**(OnLab) is a seed accelerator program run by the Digital Garage Group. There are 2 batches a year with an investment of $100K. ​ **Digital Garage US** is a technology incubator that bridges global markets and industries. By leveraging its diverse international network, Digital Garage US empowers startups, creators, and businesses to expand and innovate on a worldwide stage. # ​Event Terms and Media Release ​​​By registering for this event, you agree to release Qlay, its organizers, and all other event hosts from any liability related to your participation. You also consent to being photographed or recorded during the event, with such media potentially used for promotional purposes. Additionally, you agree to receive event updates, newsletters, and invitations from Qlay and other event hosts. You may unsubscribe from these communications at any time. Location Please register to see the exact location of this event. San Francisco, California View on Google Maps View on Google Maps View on Google Maps [| | | | --- | --- | | `←` | Move left | | `→` | Move right | | `↑` | Move up | | `↓` | Move down | | `+` | Zoom in | | `-` | Zoom out | | `Home` | Jump left by 75% | | `End` | Jump right by 75% | | `Page Up` | Jump up by 75% | | `Page Down` | Jump down by 75% |](https://www.google.com/maps/search/?api=1&query=37.786982%2C-122.403855) [ To navigate, press the arrow keys.](https://www.google.com/maps/search/?api=1&query=37.786982%2C-122.403855) View on Google Maps View on Google Maps View on Google Maps View on Google Maps View on Google MapsView larger map View on Google Maps View on Google Maps Keyboard shortcuts Map DataMap data ©2025 Google Map data ©2025 Google [500 m Click to toggle between metric and imperial units](https://www.google.com/maps/search/?api=1&query=37.786982%2C-122.403855) View on Google Maps View on Google MapsTerms Report a map error Presented by Qlay Subscribe Global Engineer Hiring Platform Hosted By Toku Yamashita Tom Nakata 274 Going Karan Goenka, Son Piaz and 272 others Contact the Host Refund Policy Report Event AI","<a href=""https://www.linkedin.com/in/tnakata"" target=""_blank"">Tom Nakata</a>","Tom Nakata is the Co-founder and CEO of Qlay, a company focused on simplifying compliance management for businesses using AI. He possesses a background in both law and technology, previously working as a lawyer before transitioning to entrepreneurship. Nakata's vision for Qlay stems from his belief that compliance should be accessible and manageable for companies of all sizes. He is passionate about leveraging AI to automate tedious and error-prone compliance tasks, freeing up resources for core business activities. Under his leadership, Qlay aims to revolutionize how businesses approach regulatory obligations.",
