event_name,event_summary,event_date,event_time,event_location,event_url,host_name,speaker_name,speaker_company,speaker_title,speaker_details,event_detail,speaker_linkedin,speaker_insight,speaker_interview_link
Startup Pitch Night,"Calling all entrepreneurs! Join us for Startup Pitch Night, an exclusive event designed to connect founders, investors, and startup enthusiasts in a dynamic and intimate setting. This is your chance to network, showcase your startup, and hear from a curated lineup of founders ready to pitch their ideas. Whether you're refining your pitch, seeking feedback, or looking to connect with potential partners or investors, this event offers valuable insights and opportunities to move your startup forward.","Thursday, June 5",5:00 PM - 8:00 PM PDT,"Palo Alto, California",https://lu.ma/rc2jawqn,owow's events,Not specified,Not specified,Not specified,Not specified,"Presented by owow's events Subscribe we help us companies hire top global talent—vetted by our human-like ai recruiter. source, vet, and hire talent—on autopilot. checkout owowtalents.com  Hosted By Gangesh Colton Kaplan OWOW Monica Claros 143 Going Deb Mukherjee, Jeffrey Martinez and 141 others Contact the Host Report Event [ Featured in San Francisco](https://lu.ma/sf?k=p) # Startup Pitch Night owow's events Jun 5 Thursday, June 5 5:00 PM - 8:00 PM PDT Register to See Address Palo Alto, California Welcome! Please choose your desired ticket type: Request to Join You will be asked to verify token ownership with your wallet. About Event ​ **Startup Pitch Night** ​Calling all entrepreneurs! Join us for **Startup Pitch Night**, an exclusive event designed to connect founders, investors, and startup enthusiasts in a dynamic and intimate setting. This is your chance to network, showcase your startup, and hear from a curated lineup of founders ready to pitch their ideas. ​Whether you're refining your pitch, seeking feedback, or looking to connect with potential partners or investors, this event offers valuable insights and opportunities to move your startup forward. ​ **Hosts:**  Founder Social Club ｜Community for founders to eliminate loneliness and connect people with mentors, investors, and peer groups. Join here! ​ **Agenda:** - ​ **5:00 pm - 6:00 pm:** Registration and Networking - ​ **6:15 pm - 7:15 pm:** Startup Pitches - ​ **7:15 pm - 8:00 pm:** Networking * * * * * * ​Thank you for our bronze sponsor BizCrush! ​ **BizCrush** is an AI-powered networking platform designed for seamless in-person connections. Built for live events, it Auto-Detected nearby attendees, AI-Created profiles, and Seamless Check-In — all in under 3 sec. ​No QR codes, No lines, No setup. Just walk in, and BizCrush does the rest. Powered by AI. Designed for Instant Connection. BizCrush upgrades traditional events into smart, interactive experiences that boost engagement and drive real follow-ups.BizCrush makes it easy to connect, engage, and follow up — instantly. ​Contact: Taemin Kwak Location Please register to see the exact location of this event. Palo Alto, California View on Google Maps View on Google Maps View on Google Maps [| | | | --- | --- | | `←` | Move left | | `→` | Move right | | `↑` | Move up | | `↓` | Move down | | `+` | Zoom in | | `-` | Zoom out | | `Home` | Jump left by 75% | | `End` | Jump right by 75% | | `Page Up` | Jump up by 75% | | `Page Down` | Jump down by 75% |](https://www.google.com/maps/search/?api=1&query=37.449345%2C-122.158595) [ To navigate, press the arrow keys.](https://www.google.com/maps/search/?api=1&query=37.449345%2C-122.158595) View on Google Maps View on Google Maps View on Google Maps View on Google Maps View on Google MapsView larger map View on Google Maps View on Google Maps Keyboard shortcuts Map DataMap data ©2025 Google Map data ©2025 Google [500 m Click to toggle between metric and imperial units](https://www.google.com/maps/search/?api=1&query=37.449345%2C-122.158595) View on Google Maps View on Google MapsTerms Report a map error Presented by owow's events Subscribe we help us companies hire top global talent—vetted by our human-like ai recruiter. source, vet, and hire talent—on autopilot. checkout owowtalents.com  Hosted By Gangesh Colton Kaplan OWOW Monica Claros 143 Going Deb Mukherjee, Jeffrey Martinez and 141 others Contact the Host Report Event",Not specified,,
Famm Fest,"Introducing Famm Fest, a Pride celebration where queer professionals celebrate pride & possibility! Join Famm Connect, StartOut, and OutPro for a one-of-a-kind evening bringing together LGBTQ+ professionals, entrepreneurs, and allies to celebrate pride, connection, and what’s possible when we come together.",Jun 20,5:00 PM - 9:00 PM PDT,"San Francisco, California",https://lu.ma/wotaekpn,Cat Perez & Marianna Di Regolo,Haley Everheart,FOLX Health,VP of Marketing,"Haley Everheart (she/they) is VP of Marketing at FOLX Health, leading efforts to expand LGBTQIA+ healthcare access and bringing 15+ years of experience building mission-driven brands featured in Teen Vogue, CNN, Forbes, and more. Madison Butler is a Black, queer founder, speaker, and advocate who founded Blue Haired Unicorn to help startups and organizations build inclusive, psychologically safe workplaces; known for her bold voice on mental health and belonging, she’s been featured in The New York Times, WSJ, Fast Company, and named a LinkedIn Top Black Voice. Michael Sui (he/him, multiracial, queer) is a leader in inclusive design (and recovering perfectionist). Over 20+ years, he’s crafted brand and user experiences for companies including Google, YouTube, Airbnb, Nokia, and Pottery Barn. He co-organizes San Francisco’s 3,000-member A11yBay Meetup community, has guest lectured at the Stanford d. School, Berkeley Haas School of Business, Kapor Center, and graduated from Carnegie Mellon University. Obsidian Adebayo (they/she) is a Britgerian entrepreneur and strategist, currently Commercial Director at Q+ Consulting and founder of the Influence Index and Olorun, with work featured in major outlets like the Financial Times and BBC News. Dr. Hitesh Tolani founded Gays of National Parks to create inclusive outdoor spaces for LGBTQ+ people through retreats and advocacy. He also started Virtudent, the first national telehealth dentistry company. His work in health, policy, and community is rooted in early advocacy during his family’s immigration fight.","Hosted By Cat Perez Marianna Di Regolo 47 Going Aaron Salazar, Wen and 45 others Contact the Host Refund Policy Report Event Wellness [ Featured in San Francisco](https://lu.ma/sf?k=p) # Famm Fest Hosted by Cat Perez & Marianna Di Regolo Jun 20 Friday, June 20 5:00 PM - 9:00 PM PDT Register to See Address San Francisco, California Suggested Price $25.00 Minimum $5.00 Sales end at Jun 20, 3:00 PM Welcome! To join the event, please get your ticket below. Get Ticket You will be asked to verify token ownership with your wallet. About Event ​Introducing Famm Fest, a Pride celebration where queer professionals celebrate pride & possibility!  Pay what you can $5 - $25! ​Join Famm Connect, StartOut, and OutPro for a one-of-a-kind evening bringing together LGBTQ+ professionals, entrepreneurs, and allies to celebrate pride, connection, and what’s possible when we come together. This is not your ordinary corporate event!  Get a new headshot  Get a tarot reading ✂ Get a hair/bang trim ️ Get a temporary tattoo ‍ Check out the sponsor exhibit  Experience a powerful panel discussion  Participate in some speed networking ️ Win some giveaways  All while listening to DJ Newoncé Gazelle The panel discussion on “Building While Resisting,” exploring the intersection of queer entrepreneurship, professionalism, advocacy, and collective survival. Meet the panelists: Haley Everheart(she/they) is VP of Marketing at FOLX Health, leading efforts to expand LGBTQIA+ healthcare access and bringing 15+ years of experience building mission-driven brands featured in _Teen Vogue_, _CNN_, _Forbes_, and more. ​ Madison Butler is a Black, queer founder, speaker, and advocate who founded Blue Haired Unicorn to help startups and organizations build inclusive, psychologically safe workplaces; known for her bold voice on mental health and belonging, she’s been featured in _The New York Times_, _WSJ_, _Fast Company_, and named a LinkedIn Top Black Voice. Michael Sui (he/him, multiracial, queer) is a leader in inclusive design (and recovering perfectionist). Over 20+ years, he’s crafted brand and user experiences for companies including Google, YouTube, Airbnb, Nokia, and Pottery Barn. He co-organizes San Francisco’s 3,000-member A11yBay Meetup community, has guest lectured at the Stanford d. School, Berkeley Haas School of Business, Kapor Center, and graduated from Carnegie Mellon University. Obsidian Adebayo (they/she) is a Britgerian entrepreneur and strategist, currently Commercial Director at Q+ Consulting and founder of the Influence Index and Olorun, with work featured in major outlets like the Financial Times and BBC News. Dr. Hitesh Tolani founded Gays of National Parks to create inclusive outdoor spaces for LGBTQ+ people through retreats and advocacy. He also started Virtudent, the first national telehealth dentistry company. His work in health, policy, and community is rooted in early advocacy during his family’s immigration fight. _The panel will be recorded and shared with our email list._ Learn more about the event here.  Pay what you can $5 - $25!  21+ event ️ SAVE THE DATE! Location Please register to see the exact location of this event. San Francisco, California View on Google Maps View on Google Maps View on Google Maps [| | | | --- | --- | | `←` | Move left | | `→` | Move right | | `↑` | Move up | | `↓` | Move down | | `+` | Zoom in | | `-` | Zoom out | | `Home` | Jump left by 75% | | `End` | Jump right by 75% | | `Page Up` | Jump up by 75% | | `Page Down` | Jump down by 75% |](https://www.google.com/maps/search/?api=1&query=37.785057%2C-122.406418) [ To navigate, press the arrow keys.](https://www.google.com/maps/search/?api=1&query=37.785057%2C-122.406418) View on Google Maps View on Google Maps View on Google Maps View on Google Maps View on Google MapsView larger map View on Google Maps View on Google Maps Keyboard shortcuts Map DataMap data ©2025 Google Map data ©2025 Google [500 m Click to toggle between metric and imperial units](https://www.google.com/maps/search/?api=1&query=37.785057%2C-122.406418) View on Google Maps View on Google MapsTerms Report a map error Hosted By Cat Perez Marianna Di Regolo 47 Going Aaron Salazar, Wen and 45 others Contact the Host Refund Policy Report Event Wellness",Haley Everheart,"Haley Everheart is the VP of Marketing at FOLX Health, a healthcare company focused on providing accessible and inclusive care for the LGBTQIA+ community. With a background in marketing leadership, she's passionate about leveraging her skills to improve health equity. Her work centers on raising awareness and driving growth for FOLX Health's services. She champions the company's mission to transform healthcare experiences for marginalized communities. Her expertise includes brand strategy and marketing campaign development.",
Famm Fest,"Introducing Famm Fest, a Pride celebration where queer professionals celebrate pride & possibility! Join Famm Connect, StartOut, and OutPro for a one-of-a-kind evening bringing together LGBTQ+ professionals, entrepreneurs, and allies to celebrate pride, connection, and what’s possible when we come together.",Jun 20,5:00 PM - 9:00 PM PDT,"San Francisco, California",https://lu.ma/wotaekpn,Cat Perez & Marianna Di Regolo,Madison Butler,Blue Haired Unicorn,"Founder, Speaker, Advocate","Haley Everheart (she/they) is VP of Marketing at FOLX Health, leading efforts to expand LGBTQIA+ healthcare access and bringing 15+ years of experience building mission-driven brands featured in Teen Vogue, CNN, Forbes, and more. Madison Butler is a Black, queer founder, speaker, and advocate who founded Blue Haired Unicorn to help startups and organizations build inclusive, psychologically safe workplaces; known for her bold voice on mental health and belonging, she’s been featured in The New York Times, WSJ, Fast Company, and named a LinkedIn Top Black Voice. Michael Sui (he/him, multiracial, queer) is a leader in inclusive design (and recovering perfectionist). Over 20+ years, he’s crafted brand and user experiences for companies including Google, YouTube, Airbnb, Nokia, and Pottery Barn. He co-organizes San Francisco’s 3,000-member A11yBay Meetup community, has guest lectured at the Stanford d. School, Berkeley Haas School of Business, Kapor Center, and graduated from Carnegie Mellon University. Obsidian Adebayo (they/she) is a Britgerian entrepreneur and strategist, currently Commercial Director at Q+ Consulting and founder of the Influence Index and Olorun, with work featured in major outlets like the Financial Times and BBC News. Dr. Hitesh Tolani founded Gays of National Parks to create inclusive outdoor spaces for LGBTQ+ people through retreats and advocacy. He also started Virtudent, the first national telehealth dentistry company. His work in health, policy, and community is rooted in early advocacy during his family’s immigration fight.","Hosted By Cat Perez Marianna Di Regolo 47 Going Aaron Salazar, Wen and 45 others Contact the Host Refund Policy Report Event Wellness [ Featured in San Francisco](https://lu.ma/sf?k=p) # Famm Fest Hosted by Cat Perez & Marianna Di Regolo Jun 20 Friday, June 20 5:00 PM - 9:00 PM PDT Register to See Address San Francisco, California Suggested Price $25.00 Minimum $5.00 Sales end at Jun 20, 3:00 PM Welcome! To join the event, please get your ticket below. Get Ticket You will be asked to verify token ownership with your wallet. About Event ​Introducing Famm Fest, a Pride celebration where queer professionals celebrate pride & possibility!  Pay what you can $5 - $25! ​Join Famm Connect, StartOut, and OutPro for a one-of-a-kind evening bringing together LGBTQ+ professionals, entrepreneurs, and allies to celebrate pride, connection, and what’s possible when we come together. This is not your ordinary corporate event!  Get a new headshot  Get a tarot reading ✂ Get a hair/bang trim ️ Get a temporary tattoo ‍ Check out the sponsor exhibit  Experience a powerful panel discussion  Participate in some speed networking ️ Win some giveaways  All while listening to DJ Newoncé Gazelle The panel discussion on “Building While Resisting,” exploring the intersection of queer entrepreneurship, professionalism, advocacy, and collective survival. Meet the panelists: Haley Everheart(she/they) is VP of Marketing at FOLX Health, leading efforts to expand LGBTQIA+ healthcare access and bringing 15+ years of experience building mission-driven brands featured in _Teen Vogue_, _CNN_, _Forbes_, and more. ​ Madison Butler is a Black, queer founder, speaker, and advocate who founded Blue Haired Unicorn to help startups and organizations build inclusive, psychologically safe workplaces; known for her bold voice on mental health and belonging, she’s been featured in _The New York Times_, _WSJ_, _Fast Company_, and named a LinkedIn Top Black Voice. Michael Sui (he/him, multiracial, queer) is a leader in inclusive design (and recovering perfectionist). Over 20+ years, he’s crafted brand and user experiences for companies including Google, YouTube, Airbnb, Nokia, and Pottery Barn. He co-organizes San Francisco’s 3,000-member A11yBay Meetup community, has guest lectured at the Stanford d. School, Berkeley Haas School of Business, Kapor Center, and graduated from Carnegie Mellon University. Obsidian Adebayo (they/she) is a Britgerian entrepreneur and strategist, currently Commercial Director at Q+ Consulting and founder of the Influence Index and Olorun, with work featured in major outlets like the Financial Times and BBC News. Dr. Hitesh Tolani founded Gays of National Parks to create inclusive outdoor spaces for LGBTQ+ people through retreats and advocacy. He also started Virtudent, the first national telehealth dentistry company. His work in health, policy, and community is rooted in early advocacy during his family’s immigration fight. _The panel will be recorded and shared with our email list._ Learn more about the event here.  Pay what you can $5 - $25!  21+ event ️ SAVE THE DATE! Location Please register to see the exact location of this event. San Francisco, California View on Google Maps View on Google Maps View on Google Maps [| | | | --- | --- | | `←` | Move left | | `→` | Move right | | `↑` | Move up | | `↓` | Move down | | `+` | Zoom in | | `-` | Zoom out | | `Home` | Jump left by 75% | | `End` | Jump right by 75% | | `Page Up` | Jump up by 75% | | `Page Down` | Jump down by 75% |](https://www.google.com/maps/search/?api=1&query=37.785057%2C-122.406418) [ To navigate, press the arrow keys.](https://www.google.com/maps/search/?api=1&query=37.785057%2C-122.406418) View on Google Maps View on Google Maps View on Google Maps View on Google Maps View on Google MapsView larger map View on Google Maps View on Google Maps Keyboard shortcuts Map DataMap data ©2025 Google Map data ©2025 Google [500 m Click to toggle between metric and imperial units](https://www.google.com/maps/search/?api=1&query=37.785057%2C-122.406418) View on Google Maps View on Google MapsTerms Report a map error Hosted By Cat Perez Marianna Di Regolo 47 Going Aaron Salazar, Wen and 45 others Contact the Host Refund Policy Report Event Wellness",Madison Butler,"Madison Butler, also known as the Blue Haired Unicorn, is a vocal advocate for diversity, equity, inclusion, and belonging in the workplace. She founded Blue Haired Unicorn, a consulting firm, to help companies create more inclusive and equitable environments. Madison is a sought-after speaker known for her candid and insightful perspectives on workplace culture and belonging. She challenges traditional norms and encourages organizations to prioritize the well-being of their employees. Butler uses her platform to amplify marginalized voices and push for systemic change in the tech industry and beyond.",
Famm Fest,"Introducing Famm Fest, a Pride celebration where queer professionals celebrate pride & possibility! Join Famm Connect, StartOut, and OutPro for a one-of-a-kind evening bringing together LGBTQ+ professionals, entrepreneurs, and allies to celebrate pride, connection, and what’s possible when we come together.",Jun 20,5:00 PM - 9:00 PM PDT,"San Francisco, California",https://lu.ma/wotaekpn,Cat Perez & Marianna Di Regolo,Michael Sui,Not specified,Leader in Inclusive Design,"Haley Everheart (she/they) is VP of Marketing at FOLX Health, leading efforts to expand LGBTQIA+ healthcare access and bringing 15+ years of experience building mission-driven brands featured in Teen Vogue, CNN, Forbes, and more. Madison Butler is a Black, queer founder, speaker, and advocate who founded Blue Haired Unicorn to help startups and organizations build inclusive, psychologically safe workplaces; known for her bold voice on mental health and belonging, she’s been featured in The New York Times, WSJ, Fast Company, and named a LinkedIn Top Black Voice. Michael Sui (he/him, multiracial, queer) is a leader in inclusive design (and recovering perfectionist). Over 20+ years, he’s crafted brand and user experiences for companies including Google, YouTube, Airbnb, Nokia, and Pottery Barn. He co-organizes San Francisco’s 3,000-member A11yBay Meetup community, has guest lectured at the Stanford d. School, Berkeley Haas School of Business, Kapor Center, and graduated from Carnegie Mellon University. Obsidian Adebayo (they/she) is a Britgerian entrepreneur and strategist, currently Commercial Director at Q+ Consulting and founder of the Influence Index and Olorun, with work featured in major outlets like the Financial Times and BBC News. Dr. Hitesh Tolani founded Gays of National Parks to create inclusive outdoor spaces for LGBTQ+ people through retreats and advocacy. He also started Virtudent, the first national telehealth dentistry company. His work in health, policy, and community is rooted in early advocacy during his family’s immigration fight.","Hosted By Cat Perez Marianna Di Regolo 47 Going Aaron Salazar, Wen and 45 others Contact the Host Refund Policy Report Event Wellness [ Featured in San Francisco](https://lu.ma/sf?k=p) # Famm Fest Hosted by Cat Perez & Marianna Di Regolo Jun 20 Friday, June 20 5:00 PM - 9:00 PM PDT Register to See Address San Francisco, California Suggested Price $25.00 Minimum $5.00 Sales end at Jun 20, 3:00 PM Welcome! To join the event, please get your ticket below. Get Ticket You will be asked to verify token ownership with your wallet. About Event ​Introducing Famm Fest, a Pride celebration where queer professionals celebrate pride & possibility!  Pay what you can $5 - $25! ​Join Famm Connect, StartOut, and OutPro for a one-of-a-kind evening bringing together LGBTQ+ professionals, entrepreneurs, and allies to celebrate pride, connection, and what’s possible when we come together. This is not your ordinary corporate event!  Get a new headshot  Get a tarot reading ✂ Get a hair/bang trim ️ Get a temporary tattoo ‍ Check out the sponsor exhibit  Experience a powerful panel discussion  Participate in some speed networking ️ Win some giveaways  All while listening to DJ Newoncé Gazelle The panel discussion on “Building While Resisting,” exploring the intersection of queer entrepreneurship, professionalism, advocacy, and collective survival. Meet the panelists: Haley Everheart(she/they) is VP of Marketing at FOLX Health, leading efforts to expand LGBTQIA+ healthcare access and bringing 15+ years of experience building mission-driven brands featured in _Teen Vogue_, _CNN_, _Forbes_, and more. ​ Madison Butler is a Black, queer founder, speaker, and advocate who founded Blue Haired Unicorn to help startups and organizations build inclusive, psychologically safe workplaces; known for her bold voice on mental health and belonging, she’s been featured in _The New York Times_, _WSJ_, _Fast Company_, and named a LinkedIn Top Black Voice. Michael Sui (he/him, multiracial, queer) is a leader in inclusive design (and recovering perfectionist). Over 20+ years, he’s crafted brand and user experiences for companies including Google, YouTube, Airbnb, Nokia, and Pottery Barn. He co-organizes San Francisco’s 3,000-member A11yBay Meetup community, has guest lectured at the Stanford d. School, Berkeley Haas School of Business, Kapor Center, and graduated from Carnegie Mellon University. Obsidian Adebayo (they/she) is a Britgerian entrepreneur and strategist, currently Commercial Director at Q+ Consulting and founder of the Influence Index and Olorun, with work featured in major outlets like the Financial Times and BBC News. Dr. Hitesh Tolani founded Gays of National Parks to create inclusive outdoor spaces for LGBTQ+ people through retreats and advocacy. He also started Virtudent, the first national telehealth dentistry company. His work in health, policy, and community is rooted in early advocacy during his family’s immigration fight. _The panel will be recorded and shared with our email list._ Learn more about the event here.  Pay what you can $5 - $25!  21+ event ️ SAVE THE DATE! Location Please register to see the exact location of this event. San Francisco, California View on Google Maps View on Google Maps View on Google Maps [| | | | --- | --- | | `←` | Move left | | `→` | Move right | | `↑` | Move up | | `↓` | Move down | | `+` | Zoom in | | `-` | Zoom out | | `Home` | Jump left by 75% | | `End` | Jump right by 75% | | `Page Up` | Jump up by 75% | | `Page Down` | Jump down by 75% |](https://www.google.com/maps/search/?api=1&query=37.785057%2C-122.406418) [ To navigate, press the arrow keys.](https://www.google.com/maps/search/?api=1&query=37.785057%2C-122.406418) View on Google Maps View on Google Maps View on Google Maps View on Google Maps View on Google MapsView larger map View on Google Maps View on Google Maps Keyboard shortcuts Map DataMap data ©2025 Google Map data ©2025 Google [500 m Click to toggle between metric and imperial units](https://www.google.com/maps/search/?api=1&query=37.785057%2C-122.406418) View on Google Maps View on Google MapsTerms Report a map error Hosted By Cat Perez Marianna Di Regolo 47 Going Aaron Salazar, Wen and 45 others Contact the Host Refund Policy Report Event Wellness","<a href=""https://sg.linkedin.com/in/michael-sui-22363213b"" target=""_blank"">Michael Sui</a>","Michael Sui is a prominent leader in the field of inclusive design, advocating for accessibility and usability for all users, regardless of their abilities or circumstances. He champions human-centered design principles and actively promotes the integration of inclusive practices across various industries. Sui works to create digital experiences that are not only accessible but also equitable and empowering for diverse populations. His work focuses on building accessible technology, promoting empathy, and fostering collaborative problem-solving to address complex accessibility challenges. Through his leadership, he strives to make a positive impact on the lives of individuals with disabilities and contribute to a more inclusive digital world.",
